{"generated_at":"2026-04-29T10:59:34+0000","season":2026,"n_teams":10,"records":[{"team":"Breiðablik","placement":1,"probability":0.3945},{"team":"Breiðablik","placement":2,"probability":0.43275},{"team":"Breiðablik","placement":3,"probability":0.1045},{"team":"Breiðablik","placement":4,"probability":0.042},{"team":"Breiðablik","placement":5,"probability":0.01825},{"team":"Breiðablik","placement":6,"probability":0.0055},{"team":"Breiðablik","placement":7,"probability":0.00175},{"team":"Breiðablik","placement":8,"probability":0.0005},{"team":"Breiðablik","placement":9,"probability":0.00025},{"team":"Breiðablik","placement":10,"probability":0},{"team":"FH","placement":1,"probability":0.00075},{"team":"FH","placement":2,"probability":0.04325},{"team":"FH","placement":3,"probability":0.188},{"team":"FH","placement":4,"probability":0.193},{"team":"FH","placement":5,"probability":0.1555},{"team":"FH","placement":6,"probability":0.1265},{"team":"FH","placement":7,"probability":0.1205},{"team":"FH","placement":8,"probability":0.08775},{"team":"FH","placement":9,"probability":0.05575},{"team":"FH","placement":10,"probability":0.029},{"team":"Fram","placement":1,"probability":0},{"team":"Fram","placement":2,"probability":0.0015},{"team":"Fram","placement":3,"probability":0.0075},{"team":"Fram","placement":4,"probability":0.029},{"team":"Fram","placement":5,"probability":0.048},{"team":"Fram","placement":6,"probability":0.06375},{"team":"Fram","placement":7,"probability":0.11},{"team":"Fram","placement":8,"probability":0.169},{"team":"Fram","placement":9,"probability":0.239},{"team":"Fram","placement":10,"probability":0.33225},{"team":"Grindavík/Njarðvík","placement":1,"probability":0},{"team":"Grindavík/Njarðvík","placement":2,"probability":0.00125},{"team":"Grindavík/Njarðvík","placement":3,"probability":0.0185},{"team":"Grindavík/Njarðvík","placement":4,"probability":0.03875},{"team":"Grindavík/Njarðvík","placement":5,"probability":0.06975},{"team":"Grindavík/Njarðvík","placement":6,"probability":0.109},{"team":"Grindavík/Njarðvík","placement":7,"probability":0.12025},{"team":"Grindavík/Njarðvík","placement":8,"probability":0.22775},{"team":"Grindavík/Njarðvík","placement":9,"probability":0.1855},{"team":"Grindavík/Njarðvík","placement":10,"probability":0.22925},{"team":"Stjarnan","placement":1,"probability":0},{"team":"Stjarnan","placement":2,"probability":0.0075},{"team":"Stjarnan","placement":3,"probability":0.06875},{"team":"Stjarnan","placement":4,"probability":0.08375},{"team":"Stjarnan","placement":5,"probability":0.09925},{"team":"Stjarnan","placement":6,"probability":0.12425},{"team":"Stjarnan","placement":7,"probability":0.145},{"team":"Stjarnan","placement":8,"probability":0.1525},{"team":"Stjarnan","placement":9,"probability":0.1615},{"team":"Stjarnan","placement":10,"probability":0.1575},{"team":"Valur","placement":1,"probability":0.0885},{"team":"Valur","placement":2,"probability":0.18575},{"team":"Valur","placement":3,"probability":0.229},{"team":"Valur","placement":4,"probability":0.16375},{"team":"Valur","placement":5,"probability":0.135},{"team":"Valur","placement":6,"probability":0.08775},{"team":"Valur","placement":7,"probability":0.06575},{"team":"Valur","placement":8,"probability":0.03375},{"team":"Valur","placement":9,"probability":0.00975},{"team":"Valur","placement":10,"probability":0.001},{"team":"Víkingur R.","placement":1,"probability":0.083},{"team":"Víkingur R.","placement":2,"probability":0.113},{"team":"Víkingur R.","placement":3,"probability":0.14175},{"team":"Víkingur R.","placement":4,"probability":0.15475},{"team":"Víkingur R.","placement":5,"probability":0.172},{"team":"Víkingur R.","placement":6,"probability":0.1365},{"team":"Víkingur R.","placement":7,"probability":0.0755},{"team":"Víkingur R.","placement":8,"probability":0.0615},{"team":"Víkingur R.","placement":9,"probability":0.04875},{"team":"Víkingur R.","placement":10,"probability":0.01325},{"team":"ÍBV","placement":1,"probability":0.43275},{"team":"ÍBV","placement":2,"probability":0.1975},{"team":"ÍBV","placement":3,"probability":0.1215},{"team":"ÍBV","placement":4,"probability":0.07875},{"team":"ÍBV","placement":5,"probability":0.063},{"team":"ÍBV","placement":6,"probability":0.0525},{"team":"ÍBV","placement":7,"probability":0.02975},{"team":"ÍBV","placement":8,"probability":0.0145},{"team":"ÍBV","placement":9,"probability":0.00775},{"team":"ÍBV","placement":10,"probability":0.002},{"team":"Þróttur R.","placement":1,"probability":0},{"team":"Þróttur R.","placement":2,"probability":0.0065},{"team":"Þróttur R.","placement":3,"probability":0.08375},{"team":"Þróttur R.","placement":4,"probability":0.13975},{"team":"Þróttur R.","placement":5,"probability":0.15125},{"team":"Þróttur R.","placement":6,"probability":0.1615},{"team":"Þróttur R.","placement":7,"probability":0.14275},{"team":"Þróttur R.","placement":8,"probability":0.117},{"team":"Þróttur R.","placement":9,"probability":0.09475},{"team":"Þróttur R.","placement":10,"probability":0.10275},{"team":"Þór/KA","placement":1,"probability":0.0005},{"team":"Þór/KA","placement":2,"probability":0.011},{"team":"Þór/KA","placement":3,"probability":0.03675},{"team":"Þór/KA","placement":4,"probability":0.0765},{"team":"Þór/KA","placement":5,"probability":0.088},{"team":"Þór/KA","placement":6,"probability":0.13275},{"team":"Þór/KA","placement":7,"probability":0.18875},{"team":"Þór/KA","placement":8,"probability":0.13575},{"team":"Þór/KA","placement":9,"probability":0.197},{"team":"Þór/KA","placement":10,"probability":0.133}],"summary":[{"team":"ÍBV","p_top_six":0.946,"p_winner":0.43275,"p_relegation":0.00975},{"team":"Breiðablik","p_top_six":0.9975,"p_winner":0.3945,"p_relegation":0.00025},{"team":"Þróttur R.","p_top_six":0.54275,"p_winner":0,"p_relegation":0.1975},{"team":"Víkingur R.","p_top_six":0.801,"p_winner":0.083,"p_relegation":0.062},{"team":"Stjarnan","p_top_six":0.3835,"p_winner":0,"p_relegation":0.319},{"team":"Valur","p_top_six":0.88975,"p_winner":0.0885,"p_relegation":0.01075},{"team":"Þór/KA","p_top_six":0.3455,"p_winner":0.0005,"p_relegation":0.33},{"team":"FH","p_top_six":0.707,"p_winner":0.00075,"p_relegation":0.08475},{"team":"Grindavík/Njarðvík","p_top_six":0.23725,"p_winner":0,"p_relegation":0.41475},{"team":"Fram","p_top_six":0.14975,"p_winner":0,"p_relegation":0.57125}]}
