{"generated_at":"2026-04-29T10:57:19+0000","season":2026,"n_teams":4,"records":[{"team":"Grindavík","placement":1,"probability":0},{"team":"Grindavík","placement":2,"probability":0.322},{"team":"Grindavík","placement":3,"probability":0.63925},{"team":"Grindavík","placement":4,"probability":0.03875},{"team":"Haukar","placement":1,"probability":0.96125},{"team":"Haukar","placement":2,"probability":0.03875},{"team":"Haukar","placement":3,"probability":0},{"team":"Haukar","placement":4,"probability":0},{"team":"Keflavík","placement":1,"probability":0},{"team":"Keflavík","placement":2,"probability":0},{"team":"Keflavík","placement":3,"probability":0.03875},{"team":"Keflavík","placement":4,"probability":0.96125},{"team":"Njarðvík","placement":1,"probability":0.03875},{"team":"Njarðvík","placement":2,"probability":0.63925},{"team":"Njarðvík","placement":3,"probability":0.322},{"team":"Njarðvík","placement":4,"probability":0}],"summary":[{"team":"Haukar","p_top_six":1,"p_winner":0.96125,"p_relegation":0},{"team":"Njarðvík","p_top_six":1,"p_winner":0.03875,"p_relegation":0.322},{"team":"Grindavík","p_top_six":1,"p_winner":0,"p_relegation":0.678},{"team":"Keflavík","p_top_six":1,"p_winner":0,"p_relegation":1}]}
