{"generated_at":"2026-04-27T23:42:42+0000","season":2026,"n_teams":4,"records":[{"team":"Grindavík","placement":1,"probability":0.8015},{"team":"Grindavík","placement":2,"probability":0.1985},{"team":"Grindavík","placement":3,"probability":0},{"team":"Grindavík","placement":4,"probability":0},{"team":"Stjarnan","placement":1,"probability":0.076},{"team":"Stjarnan","placement":2,"probability":0.35075},{"team":"Stjarnan","placement":3,"probability":0.55275},{"team":"Stjarnan","placement":4,"probability":0.0205},{"team":"Tindastóll","placement":1,"probability":0.1225},{"team":"Tindastóll","placement":2,"probability":0.45075},{"team":"Tindastóll","placement":3,"probability":0.41625},{"team":"Tindastóll","placement":4,"probability":0.0105},{"team":"Valur","placement":1,"probability":0},{"team":"Valur","placement":2,"probability":0},{"team":"Valur","placement":3,"probability":0.031},{"team":"Valur","placement":4,"probability":0.969}],"summary":[{"team":"Grindavík","p_top_six":1,"p_winner":0.8015,"p_relegation":0},{"team":"Tindastóll","p_top_six":1,"p_winner":0.1225,"p_relegation":0.42675},{"team":"Stjarnan","p_top_six":1,"p_winner":0.076,"p_relegation":0.57325},{"team":"Valur","p_top_six":1,"p_winner":0,"p_relegation":1}]}
